{
  "schemaVersion": 2,
  "expectedServiceCount": 15,
  "expectedTotals": {
    "memoryBytes": 3758096384,
    "nanoCpus": 1950000000
  },
  "schedule": {
    "intervalSeconds": 60,
    "durationSeconds": 86400,
    "expectedSamples": 1441,
    "maxScheduleLagSeconds": 5
  },
  "hostGates": {
    "minMemAvailableBytes": 1073741824,
    "minRootDiskAvailableBytes": 2147483648
  }
}
